E-352,Lower Hillsborough Watershed Activities,2020,Property encompasses 13 miles of the Hillsborough River. Land cover consists of riverine forest and pine flatwoods. ,"Invasive plant control, prescribed burn, and 50 hogs controlled",Forest/Woodland,Mix (freshwater and upland),Uplands (Non-coastal),Invasives Control/Removal - Vegetation,Rehabilitation,Enhancement,Yes,1874,,,28.114,-82.301,Southwest Florida Water Management District,,Southwest Florida Water Management District,35067,No,Internal,Protect or preserve open space,,,,,,,2020-Jul-,Combined three projects on same site,
E-353,MacDill Aquatic Invasive Species Treatment - Chemical,2020,"Human altered Surface Water Improvement and Management lake, ponds, and canals.",Chemical treatment of aquatic invasive plant species to allow proper hydrologic flow throughout a Surface Water Improvement and Management area.,Lake/Pond,Freshwater,Non-forested Freshwater Wetlands,Invasives Control/Removal - Vegetation,Maintenance,Enhancement,No,26,,,27.83207,-82.48362,United States Air Force,United States Fish and Wildlife Service,USAF,30000,No,United States Air Force,Improve or protect water quality,,,,,,,,,
E-354,MacDill Invasive Species Treatment - Mechanical,2020,Multiple locations throughout MacDill AFB of high density Brazilian pepper.,The vertical hegith reduction of Brazilian pepper in multiple locations throughout MacDill AFB.  This will allow for a more targeted approach to maintenanc of Brazilian pepper regrowth.,Forest/Woodland,Uplands,Coastal Uplands,Invasives Control/Removal - Vegetation,Rehabilitation,Enhancement,No,56,,,27.86611,-82.5087,United States Air Force,Ground Level Inc.,USAF,28000,No,United States Air Force,Protect/improve/provide habitat for other wildlife,,,,,,,2020-Sep-,,
E-355,MacDill Phase VI Living Shoreline Creation Project,2020,"MacDill Airforce Base- East Shoreline, Hillsborough Bay, large shipping channels and open fetch causing shoreline to erode ","Transplanting Spartina alterniflora and Paspalum vaginatum behind an oyster shell bar on the east shoreline of Macdill AFB with Shorecrest Academy students, and installation of oyster shell bags with community volunteers.",Estuarine Shoreline,Estuarine,Intertidal Estuarine (Other),Shoreline Stabilization/Enhancement,Establishment,Restoration,Yes,0.2,,,27.84294,-82.46948,Tampa Bay Watch,Shorecrest Academy,DOD,1000,No,EPCHC Pollution Recovery Fund,Erosion Control,,,,,,,2020-Mar-,,
E-356,MacDill Prescribed Burn,2020,Previously highly disturbed area that now supports a small sub-population of gopher torotoise.,Prescribed burn utlilizing mostly backing and flanking fire.  Stimulate the growth of herbaceous gound cover for wildlife habitat improvements.  Start of continued prescribed fire implementation on a 3-5 year rotation.,Forest/Woodland,Uplands,Coastal Uplands,Prescribed Burn,Enhancement,Enhancement,No,12,,,27.84363,-82.49188,United States Air Force,United State Fish and Wildlife Service; Colorado State University / Center for Environmental Management of Military Lands,USAF,5000,No,United States Air Force,Protect/improve/provide habitat for other wildlife,,,Eric Vichich,Cabbage palms engulfed in flames,,,2020-Sep-,,
E-357,Perico-Robinson Connector Parcel Diversity Plantings,2020,Former agricultural land that had become 100% infested with invasive hardwood trees.,Post invasives removal replanting to coastal hammock habitat.,Forest/Woodland,Uplands,Coastal Uplands,Planting,Establishment,Enhancement,Yes,1.6,,,27.49903,-82.67188,Manatee County Parks & Natural Resources Department,Tampa Bay Estuary Program,Manatee County,7000,,Tampa Bay Environmental Restoration Fund,,,,,,,,2020-Feb-,,
E-358,Pinellas County Invasive Species Removal,2020,Project took place at a neighborhood lake and various neighborhood parks in Pinellas County being taken over by Brazilian pepper,"Project included mechanical and hand removal of water lettuce, debris, and Brazilian pepper",Forest/Woodland,Mix (freshwater and upland),Uplands (Non-coastal),Invasives Control/Removal - Vegetation,Enhancement,Enhancement,No,,28,,27.822,-82.693,Keep Pinellas Beautiful,"Tampa Bay Estuary Program, Friends of Crescent Lake, Pinellas County","City of St. Pete, Pinellas County",17000,No,Bay Mini-Grant,Protect/improve/provide habitat for other wildlife,,,,,,,2019-Dec-,,
E-359,Rocky Creek Coastal Nature Preserve,2020,Tidal Wetland: Sheltered waters along the coast which are affected by both tides and freshwater run-off.,Exotic Plant Control,Mangrove,Estuarine,Mangrove Forests,Invasives Control/Removal - Vegetation,Enhancement,Enhancement,No,153,,,27.97927,-82.56646,Hillsborough County,,Hillsborough County,42120,No,BOCC,Protect/improve/provide habitat for other wildlife,,,,,,,2019-Jul-,,
E-360,Rye Preserve Invasive Plant Control,2020,Mosaic of upland and freshwater wetland habitats which had been subjected to invasive species incursion.,County staff and volunteers employ a variety of techniques to control a broad spectrum of invasive plant species,Forested Wetlands,Mix (freshwater and upland),Forested Freshwater Wetlands,Invasives Control/Removal-Vegetation,Maintenance,Enhancement,,100,,,27.51528,-82.36186,Manatee CountyParks & Natural Resources Department,Florida Fish and Wildlife Conservation Commission- Uplands Program,Manatee County,25000,,"FWC-Uplands program, Manatee County",,,,,,,,2020-Jul-,,
E-361,Salt Creek,2020,"Salt Creek is a brackish water creek that drains directly into Tampa Bay, and flows from Lake Maggiore to just south of downtown St. Petersburg",80 Volunteers removed over 650 lbs of debris,Forested Wetland,Estuarine,Mangrove Forests,Debris Removal,Enhancement,Enhancement,No,,0.75,,27.7504,-82.64048,Tampa Bay Estuary Program,Keep Pinellas Beautiful,City of St. Petersburg,500,No,EPA Work Plan,Improve or protect water quality,,,,,,,2019-Nov-,,
E-362,Southfork FY20 Invasive Plant Control,2020,"Primary natural communities are pine flatwoods, scrub, and bottomland hardwood forests. Property is a part of the Little Mantee River watershed. ",Invasive Plant Control,Forest/Woodland,Mix (freshwater and upland),Uplands (Non-coastal),Invasives Control/Removal - Vegetation,Rehabilitation,Enhancement,No,695,,,27.607,-82.245,Southwest Florida Water Management District,,Southwest Florida Water Management District,3136,No,Internal,Protect or preserve open space,,,,,,,2020-Jul-,,
E-363,Sulphur Springs,2020,"Recreational park adjacent to the Hillsborough River overtaken by invasive vines, plants and trees.",Project installed native plants (including Helianthus debilis and Gaillardia pulchella) to enhance water quality downstream in the Hillsborough River,Forest/Woodland,Uplands,Uplands (Non-coastal),Vegetation Buffer,Enhancement,Enhancement,No,1,,,28.0194,-82.44815,"Sulfur Springs Museum, Inc.","Tampa Bay Estuarty Program, Sulfur Springs Action League Neighborhood Association, Ecosphere Restoration Institute, USF","Sulfur Springs Museum, Inc",3500,No,Bay Mini-Grant,Improve or protect water quality,,,,,,,2019-Dec-,,
E-364,Sun City Center Nature Trail (PRF 16-02),2020,This project proposes the ground eradication of invasive exotic species within a 15 acre tract owned by the Sun City Center Community Association.,"Eradication of invasive exotic species within a 15-acre tract owned by the Sun City Center Community Association and the adjoining storm water conveyance owned by Hillsborough County that connects Cypress Creek and North Lake. Invasives include but are not limited to: water hyacinth, Japanese climbing fern, cogon grass, ear pod tree, carrotwood, Peruvian primrose, and Brazilian pepper. Treatment of the banks of the canal at the approach to the trail entry point consisted of foliar spraying and then manual cutting/mowing the dead vegetation. Periodic spraying and cutting will be required to maintain the current condition. Proceeding to the interior of the property, the contractor removed a large number of exotic trees, consisting of mostly carrot wood and camphor. Exotic trees up to 6 inches in diameter were felled and removed. The stumps of removed trees were treated with herbicide. Larger trees were girdled and treated. Access to the interior was cleared and widened to expedite continued restoration and maintenance. A stand of Brazilian pepper lined the property line behind the residential homes on Del Webb West. In addition, several earpod trees and some large camphor trees were located along the property line. The chemical Triclopyr @ 9% solution with basal oils was used for stump and basal treatments and glyphosate was used @ ¾ - 2% solution depending on what was being sprayed.",Forest/Woodland,Mix (freshwater and upland),Uplands (Non-coastal),Invasives Control/Removal - Vegetation,Enhancement,Enhancement,No,15,,,27.7283,-82.36113,Sun City Center Audubon Club,Sun City Center Community Association,Sun City Center Community Association,30000,No,EPC Pollution Recovery Fund,Protect/improve/provide habitat for birds,,,,,,,2019-Mar-,,
E-365,TECO/Rock Ponds FY20 Invasive Plant Control,2020,"Property is made up of various wetland communities such as freshwater creeks, marshes, tidal ponds and estuarine marshes. Adjacent to Cockroach Bay.  Restoration efforts have occurred on previous pasture lands. ",Invasive Plant Control,Forest/Woodland,Mix (estuarine and freshwater),Intertidal Estuarine (Other),Invasives Control/Removal - Vegetation,Rehabilitation,Enhancement,No,16,,,27.664,-82.505,Southwest Florida Water Management District,,Southwest Florida Water Management District,9413,No,Internal,Protect or preserve open space,,,,,,,2020-Jul-,,
E-366,Terra Ceia Huber and Frog Creek Upland,2020,"The site includes coastal uplands, including mesic flatwoods and mixed hardwoods adjoining mangroves, and has been invaded by several exotic plant species, primarily Brazilian pepper and lead tree.","Project activities included mechanical treatment of exotic plants, including Brazilian pepper, lead tree, and Australian pine, and installation of native plants including slash pine, saw palmetto, beauty berry, wax myrtle, and Florida privet. Non-native plant removal occurred on approximately 83 acres of uplands on the Huber Tractsand 29 acres from Frog Creek and over 7,200 native upland and estuarine wetland species were installed. ",Forest/Woodland,Mix (estuarine and upland),Coastal Uplands,Planting,Enhancement,Enhancement,No,112,,,27.585,-82.589,Southwest Florida Water Management District,"Tampa Bay Estuary Program, Tampa Bay Environmental Restoration Fund",Southwest Florida Water Management District,398034,No,Southwest Florida Water Management District,Protect/improve/provide habitat for other wildlife,SWFWMD,Site overgrown with non-natives including Brazilian pepper and Guinea grass. ,SWFWMD,Terra Ceia South Huber freshly mulched after non-native removal.,SWFWMD,Terra Ceia North Huber planted with native species.,2020-Jan-,TBERF,
E-367,Upper Hillsborough Turkey Habitat Improvement,2020,Property protects the upper reaches of the Hillsborough River.  River's floodplain provides natural storage of floodwaters and filtration system for runoff.,NWTF Habitat Improvement,Forest/Woodland,Mix (freshwater and upland),Uplands (Non-coastal),Bird Habitat Enhancement,Enhancement,Enhancement,No,329,,,28.208,-82.116,Southwest Florida Water Management District,"Florida Fish and Wildlife Conservation Commission, National Wildlife Turkey Federation",Southwest Florida Water Management District,40405,No,National Wildlife Turkey Federation Grant,Protect/improve/provide habitat for birds,,,,,,,2020-May-,,
E-368,Upper Hillsborough Watershed Activities,2020,Property protects the upper reaches of the Hillsborough River.  River's floodplain provides natural storage of floodwaters and filtration system for runoff.,"Invasive control of cogon grass, Old World climbing fern, and other exotic plants was conducted using herbicides (Glyphosate and Imazapyr), and a subsequent prescribed burn was conducted to restore and maintain native upland forested habitat. Non-concurrent to the prescribed burn,  19 invasive hogs were controlled.",Forest/Woodland,Mix (freshwater and upland),Uplands (Non-coastal),Invasives Control/Removal - Vegetation,Rehabilitation,Enhancement,Yes,2308,,,28.225,-82.12,Southwest Florida Water Management District,,Southwest Florida Water Management District,106401,No,Internal,Protect or preserve open space,,,,,,,2020-Jul-,Combined three projects on same site,
E-369,Weedon Island Preserve Exotic Vegetation Maintenance,2020,"Scrubby flatwoods and coastal hammock, exotic plant species impacting native vegetation","Herbicide treatment (glyphosate and triclopyr), re-treating areas currently in maintenance, rosary pea, lygodium, Brazilian pepper, Australian almund tree, punk tree, cogon grass, Guinea grass, ceasar weed, Sesbania, Pluchea carolinensis, carrotwood, Lantana, and Chinese tallow. All hardwoods were basally treated or if near water were cut and stump treated with triclopyr. All others were foliar treated with glyphosate.",Forest/Woodland,Mix (freshwater and upland),Coastal Uplands,Invasives Control/Removal - Vegetation,Maintenance,Enhancement,Yes,354,,,27.848,-82.608,Pinellas County Parks and Conservation Resources,Florida Fish and Wildlife Conservation Commission Herbicide Bank,Florida Internal Improvement Trust Fund & Pinellas County,800,No,Pinellas County General Operating Budget,Protect/improve/provide habitat for other wildlife,,,,,,,Annual,,
E-370,Woodstork Pond Connection,2020,Tidal stream connecting Wood Stork Pond to Tampa Bay Estuary via Long Bayou (Boca Ciega Bay),Project included Brazilian pepper removal and tidal stream dredging to restore tidal flushing,Forested Wetland,Estuarine,Mangrove Forests,Invasives Control/Removal - Vegetation,Enhancement,Enhancement,No,,,800,27.82864,-82.7728,Shores of Long Bayou Community Association,Tampa Bay Estuary Program,Shore of Long Bayou Community Association,13000,No,Bay Mini-Grant,Restore natural hydrology,Ernie Franke,Brazillian pepper forest starting to fill in the tidal stream and shoreline,Ernie Franke,Brazillian pepper removal and chipping. Chips stayed on-site,Ernie Franke,Brazillian Pepper cleared allowing opening up shoreline and stream,2019-Dec-,,
LS-084,McKay Bay South Oyster Reef Community Construction Project (PRF 15-05),2020,"The project will occur in an area where seagrasses have been lost due to decreased water clarity associated with nutrient over-enrichment prior to 1980 as well as having suffered from many years of developmental impacts, including dredge and fill activities, urban and industrial stormwater runoff, & industrial contamination.","Installation of new oyster shell bars and circular oyster beds along the southwestern shoreline of McKay Bay. The project’s goal is to create a greater surface area for settling oyster larvae, create habitat niches for other benthic organisms, and improve long-term water quality conditions through natural biological filtration services that oyster provide. The project will also benefit the Tampa Bay community by promoting environmental stewardship while offering hands-on opportunities to participate in Tampa Bay habitat restoration activities.",Hard Bottom,Estuarine,Oyster Bars,Reef Construction - Natural Materials,Establishment,Restoration,No,,,"3,219",27.93079,-82.42497,"Tampa Bay Watch, Inc","Mosaic Company Foundation, Tampa Bay Environmental Restoration Fund, the Royal Bank of Canada, the US Fish and Wildlife Service, Bloomin’ Brands, the Mosaic Foundation, and 1,177 community volunteers.",Port Tampa Bay,222000,No,Tampa Bay Watch,Improve or protect water quality,,,,,,,2019-Nov-,TBERF,x
LS-085,Alafia Bird Sanctuary Oyster Bar Phase 2,2020,"Project is to control erosion on the south side of Bird Island, part of the Alfia Bird Sanctuary in Tampa Bay.","Creation of an oyster bar on the south side of Bird Island to control erosion of the bird sanctuary islands and control pollution by providing substrate for oysters that will filter water, and promote growth of salt marsh grass and mangrove vegetation.",Hard Bottom,Estuarine,Oyster Bars,Shoreline Stabilization/Enhancement,Establishment,Restoration,No,,,750,27.84859,-82.40684,Audubon Florida,,The Mosaic Company and Port Tampa Bay,76500,No,EPC Pollution Recovery Fund (PRF 13-01),Protect/improve/provide habitat for birds,,,,,,,2017-Feb-,,x
LS-086,Ignacio Haya Park Living Shoreline Project,2020,"Oligohaline shoreline section of the Hillsborough River (eastside, just below the Hillsborough Aveune bridge). Boat wake derived shoreline erosion  negatively affecting native marsh at this passive linear park.","This 2,200 linear feet of park has mild to excessive erosion caused by boat wakes. This erosion has undercut the native trees, washed out the native plants/sediments, and this site has pockets of non-native vegetation. These issues were all addressed by implementing a Living Shoreline (LS) treatment, consisting of narrow band of rock placed approximately 10 feet from the original shoreline; these rocks will disrupt the boat wakes, allowing the banks to be restored with sediment and native wetland plants. Installed species included Spartina alterniflora, S. bakeri, S. patens, muhly grass, and dune sunflower.",Tidal Wetland: Sheltered waters along the coast which are affected by both tides and freshwater run-off.,Freshwater,Living Shorelines,Reestablishment,Reestablishment,Restoration,No,,,2200,27.9937,-82.46508,Ecosphere Restoration Institute,"City of Tampa, EPC, TBEP (TBERF)",City of Tampa,153000,Donated Land at no cost (Yes),"Primary Funding Source: TBERF ($76K), EPC ($47K), City of Tampa ($30K), & ERI ($8K)",Project Benefits (June 2020),Photo 1 (Before) Credit - T. Ries,Photo 1 (Before) Caption:  North end facing south; of eroded shoreline and exposed stormwater drainage pipe,Photo 2 (During) Credit - T. Ries,Photo 2 (During) Caption:  Central zone; rock revetment being placed at low tide,Photo 3 (After) Credit - T. Ries,"Photo 3 (After) Caption:  South end , plants recently installed (June 2020)",Project Completion Date (June/2020),TBERF,
LS-087,Little Bird Key Oyster Reef Ball Project,2020,"Little Bird Key - part of the Pinellas National Wildlife Refuge Islands, located just east of Tierra Verde.  The keys northwestern shoreline experiences severe erosion due to boat waking from adajacent channel.",Installing Oyster Reef Balls on the northwestern shoreline with community volunteers,Estuarine Shoreline,Estuarine,Oyster Bars,Shoreline Stabilization/Enhancement,Enhancement,Enhancement,No,,,500,27.68541,-82.71712,Tampa Bay Watch,"Tampa Bay Estuary Program Bay-Mini Grant, Friends of Tampa Bay Refuges, Tampa Bay Environmental Restoration Fund",US Fish and Wildlife,96000,No,TBERF,Erosion Control,,,,,,,2019-Dec-,TBERF,x
LS-088,MacDill Native Planting Arbor Day,2020,Previously highly disturbed area with recent prior prescribed fire imlementation.,The planting of 150 native plants (wiregrass and longleaf pine) for Arbor Day 2020.  In a previosuly disturbed area that received precribed fire in May 2019.  These plantings will help stimulate native plant growth and provide additional wildlife habitat.,Forest/Woodland,Uplands,Coastal Uplands,Planting,Rehabilitation,Enhancement,No,1,,,27.84979,-82.52998,United States Air Force,Ground Level Inc.,USAF,380,No,United States Air Force,Protect/improve/provide habitat for other wildlife,,,,,,,2020-Jan-,,
LS-089,Maximo Park Coastal Upland Restoration Project,2020,Coastal upland habitat with archaeological site with consistent recreational use,"The St. Petersburg Parks and Recreation Dept. removed all FLEPPC category I & II invasive plants and trees in the southeast and northwest portions of Maximo Park. This was accomplished through mechanical, manual, and chemical treatments. Species targeted included Brazilian pepper, carrotwood, schefflera, rosery pea, and Caesar weed.",Forest/Woodland,Uplands,Coastal Uplands,Invasives Control/Removal - Vegetation,Rehabilitation,Enhancement,No,18,,,27.71076,-82.68054,City of St. Petersburg,Tampa Bay Estuary Program,City of St. Petersburg,80000,No,Tampa Bay Estuary Program,Protect/improve/provide habitat for other wildlife,,,,,,,Not completed yet,,
R-141,Cockroach Bay Planting,2020,"Cockroach Bay Nature Preserve is 500 acres of wetlands, uplands and coastal habitats. Restoration took place on a secondary dune of 'Mount Cockroach', a hill created from intertidal excavation.","23 volunteers planted coastal upland species, including Licania michauxii, Gaillardia pulchella, and Muhlenbergia capallaris in an area where invasive plants were recently removed.",Dune,Uplands,Coastal Uplands,Sand Dune Restoration,Establishment,Restoration,No,0.3,,,27.69233,-82.50491,Tampa Bay Estuary Program,Hillsborough County,Hillsborough County,500,No,EPA Work Plan,Protect/improve/provide habitat for other wildlife,,,,,,,2020-Jan-,,
R-142,Duette Preserve Long Leaf Pine Canopy Restoration,2020,Upland habitats with high quality understory vegetative composition which had been historically logged wich removed overstory from the landscape.,"Continue canopy restoration effort in longleaf pine savannahs via planting of 5,000 containerized 1 gallon Long leaf pines (Pinus palustris)",Forest/Woodland,Uplands,Uplands (Non-coastal),Planting,Reestablishment,Restoration,,172,,,27.51405,-82.16678,Manatee CountyParks & Natural Resources Department,,Manatee County,2500,,,,,,,,,,2020-Aug-,,
R-143,Egmont Key Invasive Removal and Re-vegetation,2020,"Egmont Key is a 270 acre island and National Wildlife Refuge located at the mouth of Tampa Bay.  The island serves as an important nesting site for birds and sea turtles.  Rich in cultural history, the island is a popular destination for local boaters and is cooperatively managed with the DEP as a unit of the Florida Park Service.","The Service contracted for the chemical treatment (using Pathfinder, Tribune and Cornerstone) of invasive non-native and invasive native vegetation throughout the 270 acres in order to enhance nesting habitat for species such as Black skimmers, Royal terns, Sandwich terns, American Oystercatchers, and Brown pelicans.  As part of the project, approximately 270,000 native seedlings of various species including Sea oats, Beach grass, and Sea grapes were planted in treated areas.",Island,Uplands,Coastal Uplands,Invasives Control/Removal - Vegetation,Reestablishment,Restoration,No,270,,,27.5898,82.76282,US Fish & Wildlife Service,Florida Park Service,US Fish & Wildlife Service,294000,No,US Govt.,Protect/improve/provide habitat for birds,,,,,,,2020-Jun-,,
R-144,Emerson Point Preserve 2020 Planting,2020,Prior upland restoration habitat used to implement regeneration of endangered plant species.,"Growing out and planting federally endangered plant, Harrisia aboriginum",Forest/Woodland,Uplands,Coastal Uplands,Planting,Reestablishment,Restoration,Yes,0.1,,,27.53503,-82.62681,Manatee County Parks & Natural Resources Department,United States Fish and Wildlife Service,Manatee County,15000,,,,,,,,,,2020-Sep-,,
R-145,Little Manatee River SAV Restoration Project (PRF 15-06),2020,This project shall enhance aquatic habitat in the Little Manatee River by restoring submerged aquatic vegetation.,Restoring submerged aquatic vegetation and measuring the effectiveness of two unique planting methods. Tape grass (Vallisneria americana) will be reintroduced into the river through GrowSAV Herbivory Exclusion Cages and mechanical planting. Data collected will be used to determine the effectiveness of the two planting technologies.,Submerged Aquatic Vegetation (SAV),Freshwater,Non-forested Freshwater Wetlands,Planting,Reestablishment,Restoration,No,1.2,,,27.67597,-82.40633,Sea & Shoreline LLC,,Port Tampa Bay,57032,No,EPC Pollution Recovery Fund,Improve or protect water quality,,,,,,,2019-Feb-,,
R-147,Rye Preserve Restoration,2020,Upland habitats that had degraded due to a history of fire exclusion.,Mechanical vegetation reduction to restore system and facilitate prescribed fire for the benefit of gopher tortoises,Forest/Woodland,Uplands,Uplands (Non-coastal),Debris Removal,Reestablishment,Restoration,,30,,,27.51528,-82.36186,Manatee CountyParks & Natural Resources Department,Florida Forest Service,Manatee County,20000,,,,,,,,,,2020-Sep-,,
R-149,Vertical Oyster Gardening,2020,Volunteer docks were used to grow oyster spat before use in oyster restoration projects.,"Volunteers built and installed over 1000 Vertical Oyster Gardens throughout Gulfport, Florida",Estuarine Water Column,Estuarine,Oyster Bars,Oyster Gardening,Establishment,Restoration,No,,,1000,27.748,-82.703,Tampa Bay Watch,Tampa Bay Estuary Program,Private Gulfport Homeowners,15000,No,Bay Mini-Grant,Improve or protect water quality,Tampa Bay Watch,Installation of VOGs hanging of the dock,Tampa Bay Watch,Youth volunteers monitoring fouling/ growth on the young oyster gardens,Tampa Bay Watch,Vertical Oyster Garden after several months of deployment,2019-Dec-,,x
R-150,Winston Tract Replanting,2020,Former agricultural land that had been sodded and mowed.,"Developed and implemented a planting plan to restoration trajectory of coastal hammock. 28 volunteers from Tampa Bay Estuary Program (through their Give-A-Day activities) planted coastal wetland species including Gaillardia pulchella, Aristida stricta, and Coreopsis sp. in Manatee County's Robinson Preserve along a trail extension.",Forest/Woodland,Uplands,Coastal Uplands,Planting,Establishment,Restoration,No,1.2,,,27.49945,-82.66066,Manatee County Parks & Natural Resources Department,Tampa Bay Estuary Program (Tampa Bay Environmental Restoration Fund and Give-A-Day),Manatee County,14500,,Tampa Bay Environmental Restoration Fund,Protect/improve/provide habitat for other wildlife,,,,,,,2020-Feb-,,
