ID Number,Project Name,Year Reported,"Brief Habitat Description (sources of impacts, significant features, site uses, etc.)",Project Description,GPRA Habitat Type (more complex),Habitat Type (basic ESA categories)(existing databases),HMPU Habitat Type for Restoration,Restoration Technique (GPRA dropdown menu),GPRA Activity (slightly more complex),Basic Activity (Enhance/Rest),"Previously Reported (same location, different technique) (Yes/No dropdown menu)?",Acres,Linear Miles,Linear Feet,"Latitude (decimal degrees, minimum 3 decimals)","Longitude (decimal degrees, minimum 3 decimals)","Lead Partner/Implementor (please spell out everything, no acronyms)","Other Partners (please spell out everything, no acronyms)",Site Ownership,Total Project Cost (best guess),Donated Land at no cost (Yes/No dropdown menu),Primary Funding Source,Project Benefits (dropdown menu),Photo 1 (Before) Credit,Photo 1 (Before) Caption,Photo 2 (During) Credit,Photo 2 (During) Caption,Photo 3 (After) Credit,Photo 3 (After) Caption,Project Completion Date (month/year) (start date prior to 2020),TBEP Notes,Oyster?
E-001,Howard Frankland West,1971,,planting of red mangroves,,Estuarine,,planting of red mangroves,,Enhancement,,0.01,,,27.94169,-82.54922,FDNR,,,,,,,,,,,,,,,
E-002,Terra Ceia Bird Key ,1972,,"planting of red, black, and white mangroves",,Estuarine,,"planting of red, black, and white mangroves",,Enhancement,,0.003,,,27.61633,-82.56563,FDNR,,,,,,,,,,,,,,,
E-003,Mullet Key,1973,,"planting of red, black, and white mangroves",,Estuarine,,"planting of red, black, and white mangroves",,Enhancement,,0.03,,,27.64755,-82.71522,FDNR,,,,,,,,,,,,,,,
E-004,Fishhook Spoil,1974,,planting of red mangroves,,Estuarine,,planting of red mangroves,,Enhancement,,0.02,,,27.80267,-82.41917,FDNR,,,,,,,,,,,,,,,
E-005,Fishhook Spoil,1976,,planting of Spartina alterniflora,,Estuarine,,planting of Spartina alterniflora,,Enhancement,,0.01,,,27.80267,-82.41917,FDNR,,,,,,,,,,,,,,,
E-006,Alafia Bank Sunken Island Extension-Phase 1,1978,,planting of Spartina alterniflora,,Estuarine,,planting of Spartina alterniflora,,Enhancement,,2,,,27.84414,-82.41983,Audubon of Florida,,,,,,,,,,,,,,,
E-007,Alafia Bank Sunken Island Extension-Phase 2,1979,,planting of Spartina alterniflora,,Estuarine,,planting of Spartina alterniflora,,Enhancement,,0.1,,,27.84414,-82.41983,Audubon of Florida,,,,,,,,,,,,,,,
E-008,Alafia Bank Sunken Island Extension-Phase 3,1979,,planting of Spartina alterniflora,,Estuarine,,planting of Spartina alterniflora,,Enhancement,,2,,,27.84664,-82.41983,Audubon of Florida,,,,,,,,,,,,,,,
E-009,Palm River,1979,,"planting of Spartina alterniflora, Paspalum",,Estuarine,,"planting of Spartina alterniflora, Paspalum",,Enhancement,,0.17,,,27.94167,-82.40809,FDNR,,,,,,,,,,,,,,,
LS-001,Palm River,1979, ,"planting of Spartina alterniflora, Paspalum",,Estuarine,,,,Enhancement,,,,50,27.9424,-82.4083,FDNR, ,,0,, ,"planting of Spartina alterniflora, Paspalum",,,,,,, ,,
E-010,Alafia Bank Sunken Island Extension-Phase 4,1980,,planting of Spartina alterniflora,,Estuarine,,planting of Spartina alterniflora,,Enhancement,,0.1,,,27.84664,-82.41983,Audubon of Florida,,,,,,,,,,,,,,,
E-011,Channel A,1980,,planting of Spartina alterniflora,,Estuarine,,planting of Spartina alterniflora,,Enhancement,,2,,,27.99911,-82.61671,FDNR,,,,,,,,,,,,,,,
E-100,E.G. Simmons Park,1980,,planting of Spartina alterniflora,,Estuarine,,planting of Spartina alterniflora,,Enhancement,,1.98,,,27.7448,-82.47223,FDNR,,,,,,,,,,,,,,,
E-013,Spoil Island CMDA-2D,1985,,Planting of Spartina alterniflora,,Estuarine,,Planting of Spartina alterniflora,,Enhancement,,10,,,27.87395,-82.43123,TPA ,,,,,,,,,,,,,,,
E-014,Hendry Delta,1986,,planting of Spartina alterniflora,,Estuarine,,planting of Spartina alterniflora,,Enhancement,,0.05,,,27.62546,-82.56553,FDNR,,,,,,,,,,,,,,,
E-015,Pinellas Point,1986,,"planting of Spartina alterniflora, red, white, and black mangroves",,Estuarine,,"planting of Spartina alterniflora, red, white, and black mangroves",,Enhancement,,0.04,,,27.70018,-82.65252,FDNR,,,,,,,,,,,,,,,
E-016,Regatta Point,1986,,planting of Spartina,,Estuarine,,planting of Spartina,,Enhancement,,0.03,,,27.51181,-82.57634,FDNR,,,,,,,,,,,,,,,
E-017,Apollo Beach Seawall,1987,,planting of red mangroves,,Estuarine,,planting of red mangroves,,Enhancement,,0.01,,,27.79598,-82.41983,FDNR,,,,,,,,,,,,,,,
E-018,Hendry Delta,1987,,"planting of Spartina alterniflora, red mangroves",,Estuarine,,"planting of Spartina alterniflora, red mangroves",,Enhancement,,0.1,,,27.65246,-82.56553,FDNR,,,,,,,,,,,,,,,
E-019,Largo Narrows Park,1987,,"planting of Spartina, mangroves",,Estuarine,,"planting of Spartina, mangroves",,Enhancement,,0.15,,,27.84134,-82.83925,FDNR,,,,,,,,,,,,,,,
E-020,Little Bird Key/Boca Ceiga,1987,,planting of red mangroves,,Estuarine,,planting of red mangroves,,Enhancement,,0.015,,,27.79297,-82.77787,FDNR,,,,,,,,,,,,,,,
E-021,Pinellas Point,1987,,planting of Spartina alterniflora,,Estuarine,,planting of Spartina alterniflora,,Enhancement,,0.03,,,27.70018,-82.65252,FDNR,,,,,,,,,,,,,,,
E-022,Port Manatee (SR 92),1987,,planting of Spartina alterniflora,,Estuarine,,planting of Spartina alterniflora,,Enhancement,,0.05,,,27.63472,-82.57302,FDNR,,,,,,,,,,,,,,,
E-023,Rattlesnake Key (SR 96),1987,,planting of Spartina alterniflora,,Estuarine,,planting of Spartina alterniflora,,Enhancement,,0.05,,,27.5797,-82.60861,FDNR,,,,,,,,,,,,,,,
E-024,Regatta Point,1987,,planting of Spartina alterniflora,,Estuarine,,planting of Spartina alterniflora,,Enhancement,,0.01,,,27.51181,-82.57634,FDNR,,,,,,,,,,,,,,,
R-001,Peanut Lake Rotary Ditching,1987,,Restore tidal flushing,,Estuarine,,Rotary ditching,,Restoration,,100,,,27.623,-82.56174,FDER,,,,,,,,,,,,,,,
E-025,Alafia Bank Bird Island,1988,,planting of Spartina alterniflora,,Estuarine,,planting of Spartina alterniflora,,Enhancement,,0.06,,,27.84822,-82.40561,Audubon of Florida,,,,,,,,,,,,,,,
E-026,Hendry Delta,1988,,planting of Spartina alterniflora,,Estuarine,,planting of Spartina alterniflora,,Enhancement,,0.15,,,27.62546,-82.56553,FDNR,,,,,,,,,,,,,,,
E-027,North Sunshine Skyway,1988,,planting of Spartina alterniflora,,Estuarine,,planting of Spartina alterniflora,,Enhancement,,0.05,,,27.70147,-82.67827,FDNR,,,,,,,,,,,,,,,
E-028,Pinellas Point ,1988,,planting of red mangroves,,Estuarine,,planting of red mangroves,,Enhancement,,0.05,,,27.70018,-82.65252,FDNR,,,,,,,,,,,,,,,
E-029,Regatta Point,1988,,"planting of Spartina alterniflora, white mangroves",,Estuarine,,"planting of Spartina alterniflora, white mangroves",,Enhancement,,0.02,,,27.51181,-82.57634,FDNR,,,,,,,,,,,,,,,
E-030,Alafia Bank Bird Island,1989,,planting of Spartina alterniflora,,Estuarine,,planting of Spartina alterniflora,,Enhancement,,0.2,,,27.84976,-82.40566,Audubon of Florida,,,,,,,,,,,,,,,
E-031,Maximo Park,1989,,"planting of Spartina alterniflora, red mangroves",,Estuarine,,"planting of Spartina alterniflora, red mangroves",,Enhancement,,0.05,,,27.71004,-82.68367,FDNR,,,,,,,,,,,,,,,
R-002,Cabbagehead Bayou,1989,,cut berm breach to restore tidal flow to Cabbagehead Bayou,,Estuarine,,cut berm breach to restore tidal flow to Cabbagehead Bayou,,Restoration,,50,,,27.99818,-82.61724,SWFWMD-SWIM,,,,,,,,,,,,,,,
R-003,Hendry Delta Fill,1989,,estuarine wetlands,,Estuarine,,"Substrate modification, planting",,Restoration,,3,,,27.62546,-82.56553,SWFWMD-SWIM,,,,,,,,,,,,,,,
E-032,Green Key,1990,,planting of Spartina alterniflora,,Estuarine,,planting of Spartina alterniflora,,Enhancement,,0.03,,,27.81831,-82.39918,Audubon of Florida,,,,,,,,,,,,,,,
E-033,South Bayshore Boulevard,1990,,planting of Spartina alterniflora,,Estuarine,,planting of Spartina alterniflora,,Enhancement,,1.5,,,27.87472,-82.48678,SWFWMD-SWIM,,,,,,,,,,,,,,,
E-034,Terra Ceia Bird Key - Nina Griffith Washburn Bird Sanctuary,1990,,planting of Spartina alterniflora,,Estuarine,,planting of Spartina alterniflora,,Enhancement,,0.1,,,27.55233,-82.60012,Audubon of Florida,,,,,,,,,,,,,,,
E-115,Whiskey Stump Key,1990,,"planting of Spartina alterniflora, 2,000 units",,Estuarine,,planting of Spartina alterniflora,,Enhancement,,0.5,,,27.81302,-82.40247,Audubon of Florida,,,,,,,,,,,,,,,
R-004,Boca Ceiga (Milenum Park),1990,,"Excavation, planting of Spartina alterniflora",,Estuarine,,"Excavation, planting of Spartina alterniflora",,Restoration,,2.5,,,27.8325,-82.81256,FDNR,,,,,,,,,,,,,,,
R-005,Delaney Pop-Off Canal,1990,,"Intertidal creek restoration, removed spoil banks",,Estuarine,,"Streambank grading, planting",,Restoration,,10,,,27.88512,-82.40251,FDEP,,,,,,,,,,,,,,,
R-006,E.G. Simmons Park: Phase 1,1990,,restoration of open water and estuarine wetlands,,Estuarine,,"Substrate modification, planting",,Restoration,,14,,,27.7448,-82.47223,SWFWMD-SWIM,,,,,,,,,,,,,,,
R-007,Joe's Creek Restoration: Phase 1,1990,,"Rotary ditching, exotic removal, clearing and planting of Spartina alterniflora",,Estuarine,,"Excavation, Invasive Removal – Vegetation, Planting of Spartina alterniflora",,Restoration,,4.61,,,27.83834,-82.75289,FDER,,,,,,,,,,,,,,,
R-008,Polanis Park,1990,,planting of Spartina alterniflora,,Estuarine,,"Excavation, grading, planting of Spartina alterniflora, removal of invasives",,Restoration,,3.3,,,27.89221,-82.5403,FDNR,,,,,,,,,,,,,,,
R-009,Foch Lake,1991,,"filling to shallow depth, dredged tidal channels, exotic removal",,Estuarine,,filling to shallow depth,,Restoration,,3.9,,,27.82653,-82.62078,FDER,,,,,,,,,,,,,,,
R-010,Joe's Creek Restoration: Phase 2 ,1991,,"exotic removal, clearing and planting of Spartina alterniflora",,Estuarine,,"Regrading, Invasive Removal – Vegetation, Planting of Spartina alterniflora",,Restoration,,6.06,,,27.83834,-82.75289,FDER,,,,,,,,,,,,,,,
R-011,Mangrove Bay: Phase 1,1991,,low salinity open water estuarine and wetlands and uplands,,Estuarine,,"Substrate modification, planting",,Restoration,,13.5,,,27.84259,-82.62981,SWFWMD-SWIM,,,,,,,,,,,,,,,
R-012,McKay Bay Northeast,1991,,low salinity esturaine wetlands and uplands,,Estuarine,,"Substrate modification, planting",,Restoration,,4,,,27.95212,-82.4114,SWFWMD-SWIM,City of Tampa,,116775,,,,,,,,,,,,
E-036,Port Manatee Parcel Restoration Project,1992,,"Marsh and mangrove restoration, exotic plant removal, upland restoration",,"Mix (estuarine, freshwater, and upland)",,Exotic removal and restoration,,Enhancement,,700,,,27.63472,-82.57302,TECO,,,,,,,,,,,,,,,
LS-002,Lowry Park: Shoreline,1992, ,Freshwater and low salinity wetlands,,Estuarine,,,,Enhancement,,,,400,28.01443,-82.46453,SWFWMD-SWIM,"FDEP, City of Tampa",,18000,, ,"Substrate modification, planting",,,,,,, ,,
R-013,Boca Ciega: Phase 1,1992,,low salinity open water and estuarine and freshwater wetlands,,Mix (estuarine and freshwater),,"Substrate modification, planting",,Restoration,,3.5,,,27.8325,-82.81256,SWFWMD-SWIM,,,,,,,,,,,,,,,
R-014,Joe's Creek Restoration: Phase 3,1992,,"exotic removal, clearing and planting of Spartina alterniflora",,Estuarine,,"Invasive Removal – Vegetation, Planting of Spartina alterniflora",,Restoration,,1.83,,,27.83834,-82.75289,FDER,,,,,,,,,,,,,,,
R-015,Lake Tarpon Outfall Canal: Phase 1,1992,,estuarine/low salinity wetlands,,Estuarine,,"Substrate modification, planting of Spartina",,Restoration,,1,,,28.05315,-82.70892,SWFWMD-SWIM,Volunteers,,2000,,,,,,,,,,,,
R-016,Little Bayou Habitat Restoration Project: Phase 1,1992,,Restoration of tidal creek ,,Estuarine,,"Excavation, planting",,Restoration,,3,,,27.71901,-82.63769,SWFWMD-SWIM,,,,,,,,,,,,,,,
R-017,Lowry Park: Spring,1992,,Freshwater and low salinity wetlands,,Estuarine,,"Substrate modification, planting",,Restoration,,0.5,,,28.01475,-82.4646,SWFWMD-SWIM,"FDEP, City of Tampa",,18000,,,,,,,,,,,,
R-018,Mangrove Bay Pit Filling ,1992,,filling to shallow depth from 27 feet to 10 feet,,Estuarine,,,,Restoration,,20,,,27.84259,-82.62981,FDEP,,,,,,,,,,,,,,,
R-019,Mangrove Bay: Phase 2,1992,,"estuarine wetlands, artificial reefs",,Estuarine,,"Substrate modification, planting",,Restoration,,0.5,,,27.83979,-82.62582,SWFWMD-SWIM,,,,,,,,,,,,,,,
SEP-001,Gandy Park,1992, ,Block planters with mangroves at shoreline,,Estuarine,,,,Restoration,,,,100,27.89038,-82.53945,Tampa Bay Estuary Program, ,,0,, , ,,,,,,, ,,
LS-003,Hamilton Creek,1993, ,Stream restoration and planting,,Freshwater,,,,Enhancement,,,,250,28.01371,-82.46536,SWFWMD-SWIM, ,,0,, ,Stream restoration and planting,,,,,,, ,,
LS-004,Picnic Island,1993, ,Living shoreline associated with larger wetland restoration effort,,Estuarine,,,,Restoration,,,,300,27.85732,-82.55182,SWFWMD-SWIM, ,,0,, ,"Substrate modification, planting",,,,,,, ,,
R-020,Boca Ciega: Phase 2,1993,,estuarine and freshwater wetlands ,,Mix (estuarine and freshwater),,"Substrate modification, planting",,Restoration,,1,,,27.8325,-82.81256,SWFWMD-SWIM,,,,,,,,,,,,,,,
R-021,Freeman Park,1993,,"Create tidal lagoon, enhanced hardened shoreline, Plantings of Spartina alterniflora, exotic removal",,Estuarine,,"Excavation, planting of Spartina alterniflora, Exotic removal",,Restoration,,7,,,27.89221,-82.5403,BAEAT,,,,,,,,,,,,,,,
R-022,Peanut Lake,1993,,"estuarine, open water, and wetlands",,Estuarine,,"Substrate modification, planting",,Restoration,,10,,,27.62297,-82.55627,FDEP,,,,,,,,,,,,,,,
R-023,Picnic Island,1993,,Estuarine open water and wetlands and uplands,,Estuarine,,"Substrate modification, planting",,Restoration,,8,,,27.85288,-82.5527,SWFWMD-SWIM,,,,,,,,,,,,,,,
R-024,Al Lopez Park,1994,,planting of freshwater wetlands,,Freshwater,,planting of freshwater wetlands,,Restoration,,2,,,27.99093,-82.50309,SWFWMD-SWIM,,,,,,,,,,,,,,,
R-025,Harbor Palms Park,1994,,low salinity estuarine wetlands and open water and stormwater polishing,,Estuarine,,"Substrate modification, planting",,Restoration,,4.4,,,28.03928,-82.69337,SWFWMD-SWIM,City of Oldsmar,,118541,,,,,,,,,,,,
R-026,Howard Frankland East,1994,,estuarine wetlands and fringing uplands,,Estuarine,,,,Restoration,,3,,,27.94214,-82.54567,SWFWMD-SWIM,FDOT,,60000,,,,,,,,,,,,
R-027,Jungle Prada Park,1994,,estuarine wetlands and open water habitat,,Estuarine,,"Substrate modification, planting",,Restoration,,1,,,27.7874,-82.75363,SWFWMD-SWIM,,,,,,,,,,,,,,,
R-028,MacDill Air Force Base: Phase 1A,1994,,"low salinity, estuarine wetlands, open water and uplands",,Mix (estuarine and upland),,"Substrate modification, planting",,Restoration,,3,,,27.82976,-82.47662,SWFWMD-SWIM,,,,,,,,,,,,,,,
R-029,Terra Ceia Causeway,1994,,estuarine wetlands,,Estuarine,,"Substrate modification, planting",,Restoration,,2.2,,,27.56873,-82.57104,SWFWMD-SWIM,,,,,,,,,,,,,,,
R-030,Ballast Point,1995,,restoration of estuarine wetlands,,Estuarine,,"Substrate modification, planting",,Restoration,,0.5,,,27.88898,-82.48064,SWFWMD-SWIM,,,,,,,,,,,,,,,
R-031,Cargill South Parcel,1995,,"Coastal Habitat Restoration, Brazilian Pepper Removal, Re-established south channel of Alafia River",,Estuarine,,"Canal Dredging, Planting of Spartina alterniflora",,Restoration,,50,,,27.84223,-82.39007,FDEP,,,,,,,,,,,,,,,
R-032,Clam Bayou (Osgood Point): Phase 1,1995,,"estuarine, open water, and wetlands",,Estuarine,,"Substrate modification, planting of Spartina",,Restoration,,10,,,27.73806,-82.69146,SWFWMD-SWIM,,,,,,,,,,,,,,,
R-033,Joe's Creek: Phase 1A,1995,,estuarine and low salinity wetlands,,Estuarine,,"Substrate modification, planting",,Restoration,,0.5,,,27.83192,-82.7544,SWFWMD-SWIM,,,,,,,,,,,,,,,
R-034,Jungle Lake Restoration,1995,,"Re-countouring of area, Exotic removal, planting of native species",,Freshwater,,,,Restoration,,35,,,27.79701,-82.74555,City of St. Petersburg,,,,,,,,,,,,,,,
R-035,Lake Tarpon Outfall Canal: Phase 2,1995,,estuarine/low salinity wetlands,,Estuarine,,"Substrate modification, planting",,Restoration,,1,,,28.05315,-82.70892,SWFWMD-SWIM,Volunteers,,,,,,,,,,,,,,
R-036,Long/Cross Bayou,1995,,estuarine wetlands - low salinity,,Estuarine,,"estuarine wetlands - low salinity, Spartina alterniflora",,Restoration,,2,,,27.8305,-82.75461,SWFWMD-SWIM,,,,,,,,,,,,,,,
R-037,Allen's Creek at St. Paul's Drive,1996,,estuarine wetlands - low salinity,,Estuarine,,"Substrate modification, planting",,Restoration,,1,,,27.93158,-82.75393,SWFWMD-SWIM,Pinellas County,,40000,,,,,,,,,,,,
R-038,Cockroach Bay: Phase 1B2,1996,,tidal creek system with marshes,,Estuarine,,"Substrate modification, planting",,Restoration,,18.5,,,27.6846,-82.49936,SWFWMD-SWIM,,,,,,,,,,,,,,,
E-037,Abercrombie Park,1997,,"Exotic removal, planting of native species",,Upland,,,,Enhancement,,11,,,27.80624,-82.75694,City of St. Petersburg Parks Department,,,,,,,,,,,,,,,
LS-005,Epps Park Shoreline Restoration,1997, ,"Hillsborough River shoreline protection and restoration, planting, rip rap placement",,Freshwater,,,,Restoration,,,,250,28.00542,-82.46778,City of Tampa,SWFWMD,,0,, ,Freshwater wetlands,,,,,,, ,,
R-039,Cockroach Bay: Phase 1A1,1997,,"create estuarine open water channels, lagoon, marshes, and some uplands",,Mix (estuarine and upland),,"Substrate modification, planting",,Restoration,,37.2,,,27.69246,-82.51073,SWFWMD-SWIM,,,,,,,,,,,,,,,
R-040,Cockroach Bay: Phase 1B,1997,,freshwater and low salinity wetlands that also provide stormwater treatment,,Mix (estuarine and freshwater),,"Substrate modification, planting",,Restoration,,24.5,,,27.68614,-82.49926,SWFWMD-SWIM,,,,,,,,,,,,,,,
R-041,Del Oro Park,1997,,low salinity esturine wetlands,,Estuarine,,"Excavation, planting",,Restoration,,1,,,27.97044,-82.70532,SWFWMD-SWIM,City of Clearwater,,30000,,,,,,,,,,,,
R-042,Epps Park Shoreline Restoration,1997,,"Hillsborough River shoreline protection and restoration, planting, rip rap placement, associated with living shoreline project",,Freshwater,,Freshwater wetlands,,Restoration,,1,,,28.00504,-82.4677,City of Tampa,SWFWMD,,,,,,,,,,,,,,
R-043,MacDill Air Force Base: Phase 1B,1997,,"low salinity, estuarine wetlands, open water and uplands",,Mix (estuarine and upland),,"Substrate modification, planting",,Restoration,,31.3,,,27.82976,-82.47332,SWFWMD-SWIM,,,,,,,,,,,,,,,
E-038,Skyway Jacks,1998,,planting of Spartina alterniflora,,Estuarine,,planting of Spartina alterniflora,,Enhancement,,1,,,27.70596,-82.68081,FDNR,,,,,,,,,,,,,,,
R-044,Bartlett Park,1998,,low salinity tidal creek and wetlands,,Estuarine,,"Substrate modification, planting",,Restoration,,4,,,27.74929,-82.63929,SWFWMD-SWIM,,,,,,,,,,,,,,,
R-045,Cypress Point Park Restoration,1998,,"Created tidal lagoons, replanting shoreline",,Estuarine,,,,Restoration,,3,,,27.95087,-82.5418,City of Tampa,SWFWMD,,,,,,,,,,,,,,
R-046,Emerson Point: Phase 1,1998,,low salinity estuarine wetlands and estuarine wetlands,,Estuarine,,"Substrate modification, planting",,Restoration,,25,,,27.53391,-82.63222,SWFWMD-SWIM,,,,,,,,,,,,,,,
R-047,Mangrove Bay: Phase 3,1998,,estuarine low salinity open water and wetlands,,Estuarine,,"Substrate modification, planting",,Restoration,,21,,,27.83535,-82.6228,SWFWMD-SWIM,,,,,,,,,,,,,,,
R-048,Mobbly Bayou: Phase 1,1998,,low salinity estuarine open water and wetlands,,Estuarine,,"Substrate modification, planting",,Restoration,,14,,,28.02614,-82.66208,SWFWMD-SWIM,City of Oldsmar,,200000,,,,,,,,,,,,
R-049,Weedon Island,1998,,planting of Spartina alterniflora,,Estuarine,,,,Restoration,,0.1,,,27.84698,-82.60949,SWFWMD-SWIM,,,,,,,,,,,,,,,
E-039,Coquina Key Park,1999,,Exotic removal,,Estuarine,,,,Enhancement,,1,,,27.73741,-82.63113,City of St. Petersburg Parks Department,,,,,,,,,,,,,,,
E-040,Desoto Park And Trailer Park In NW McKay Bay,1999,,primarily a stormwater improvement project but some native plants installed,,Estuarine,,,,Enhancement,,1,,,27.94755,-82.42834,City of Tampa,SWFWMD,,,,,,,,,,,,,,
E-041,Rocky/Brushy (Sheldon Road off Sheldon north of Fountain Avenue),1999,,Establishment of freshwater forested wetland,,Freshwater,,Control of exotics/invasive plants as Maintenance,,Enhancement,,0.955,,,28.01178,-82.58063,Hillsborough County,,,,,,,,,,,,,,,
E-042,Tampa Bay Oil Spill - Boca Ciega Bay (Bird Island Salt Marsh Planting),1999,,marsh plants installed,,Estuarine,,,,Enhancement,,0.1,,,27.7965,-82.7665,NOAA,,,,,,,,,,,,,,,
E-043,Tampa Bay Oil Spill - Boca Ciega Bay (Cross Bayou Mangrove Restoration),1999,,marsh plants installed,,Estuarine,,,,Enhancement,,4.8,,,27.835,-82.76,NOAA,,,,,,,,,,,,,,,
E-044,Tampa Bay Oil Spill - Boca Ciega Bay (Turtle Crawl Point Saltmarsh Planting),1999,,Planting of Spartina alterniflora,,Estuarine,,,,Enhancement,,1.5,,,27.7997,-82.7712,NOAA,,,,,,,,,,,,,,,
LS-006,Rivercrest Park,1999, ,Living shoreline/breakwater with native vegetation to protect shoreline,,Estuarine,,,,Restoration,,,,800,27.99616,-82.46534,City of Tampa, ,,0,, , ,,,,,,, ,,
R-050,Boca Ciega: Phase 3,1999,,estuarine and freshwater wetlands ,,Mix (estuarine and freshwater),,"Excavation, planting",,Restoration,,2.5,,,27.8325,-82.81256,SWFWMD-SWIM,,,,,,,,,,,,,,,
R-051,Braden River: Phase 2 (SR70),1999,,estuarine wetlands - low salinity,,Estuarine,,"Excavation, planting",,Restoration,,10,,,27.45025,-82.49113,SWFWMD-SWIM,,,,,,,,,,,,,,,
R-052,Cockroach Bay: Phase 1 Uplands,1999,,coastal uplands - mixed pine and harwood forest,,Upland,,Planting,,Restoration,,45,,,27.68937,-82.50339,SWFWMD-SWIM,,,,,,,,,,,,,,,
R-053,Cockroach Bay: Phase 1A2,1999,,"create estuarine open water channels, lagoon, marshes, and some uplands",,Mix (estuarine and upland),,"Substrate modification, planting",,Restoration,,55.8,,,27.69444,-82.50737,SWFWMD-SWIM,,,,,,,,,,,,,,,
R-054,Coopers Point,1999,,estuarine open water and wetlands,,Estuarine,,"Substrate modification, planting",,Restoration,,10,,,27.96861,-82.69359,SWFWMD-SWIM,City of Clearwater,,200000,,,,,,,,,,,,
R-055,Emerson Point: Phase 2,1999,,low salinity estuarine wetlands and estuarine wetlands,,Estuarine,,"Substrate modification, planting",,Restoration,,5,,,27.53394,-82.62577,SWFWMD-SWIM,,,,,,,,,,,,,,,
R-056,Lake Thonotosassa Project,1999,,"Excavation, Planting of native species",,Freshwater,,"Excavation, Planting of native species",,Restoration,,80,,,28.054,-82.26881,SWFWMD,"EPCHC, FDEP",,,,,,,,,,,,,,
R-057,MacDill Air Force Base: Phase 2,1999,,"low salinity, estuarine wetlands, open water and uplands",,Mix (estuarine and upland),,"Substrate modification, planting",,Restoration,,32.6,,,27.82221,-82.47964,SWFWMD-SWIM,,,,,,,,,,,,,,,
R-058,South Skyway,1999,,estuarine wetlands,,Estuarine,,"Substrate modification, planting",,Restoration,,3,,,27.58402,-82.59946,SWFWMD-SWIM,,,,,,,,,,,,,,,
E-045,Peri Island Salt Marsh Restoration,2000,,marsh plants installed,,Estuarine,,,,Enhancement,,1,,,27.8108,-82.7954,Tampa Bay Watch,,,,,,,,,,,,,,,
E-046,Spoil Island Boca Ciega Bay Salt Marsh Restoration,2000,,Planting of Spartina alterniflora,,Estuarine,,,,Enhancement,,1,,,27.816,-82.7981,Tampa Bay Watch,,,,,,,,,,,,,,,
R-059,Braden River: Phase 1 (SR64),2000,,estuarine wetlands - low salinity,,Estuarine,,"Excavation, planting",,Restoration,,10,,,27.49809,-82.52193,SWFWMD-SWIM,,,,,,,,,,,,,,,
R-060,Clam Bayou (Osgood Point): Phase 2,2000,,estuarine open water and wetlands and some low salinity,,Estuarine,,"Substrate modification, planting of Spartina",,Restoration,,10,,,27.74507,-82.68789,SWFWMD-SWIM,,,,,,,,,,,,,,,
R-061,Palmetto Estuary,2000,,"estuarine wetlands, low salinity wetlands and uplands",,Mix (estuarine and upland),,"Substrate modification, planting",,Restoration,,26,,,27.51161,-82.56415,SWFWMD-SWIM,Ecosphere Restoration Institute,,,,,,,,,,,,,,
E-047,Fort Brooke Salt Marsh Restoration,2001,,Planting of Spartina alterniflora,,Estuarine,,,,Enhancement,,0.5,,,27.9417,-82.4583,City of Tampa,"NOAA, TBW, SWFWMD-SWIM",,,,,,,,,,,,,,
E-048,Grandview Park,2001,,Exotic removal,,Estuarine,,,,Enhancement,,2.5,,,27.73646,-82.64011,City of St. Petersburg Parks Department,,,,,,,,,,,,,,,
E-049,MacDill Airforce Base Salt Marsh Restoration,2001,,Planting of Spartina alterniflora,,Estuarine,,,,Enhancement,,3,,,27.8215,-82.4747,Tampa Bay Watch,,,,,,,,,,,,,,,
R-062,Davis Tract Salt Marsh Restoration,2001,,regrading of slopes and marsh planting,,Estuarine,,,,Restoration,,7,,,27.8346,-82.3957,Tampa Bay Watch,,,,,,,,,,,,,,,
R-063,Fort Brooke Park Shoreline Restoration,2001,,"dock and warf removal, shoreline restoration revegetated with wetland and coastal habitat plants",,Estuarine,,,,Restoration,,1,,,27.94722,-82.45833,City of Tampa,SWFWMD,,,,,,,,,,,,,,
R-064,Red Maple Swamp (Allen's Creek),2001,,Excavation and re-establishment of marsh,,Freshwater,,"Excavation, Planting of native species",,Restoration,,8.2,,,27.95023,-82.75122,City of Clearwater,"SWIM, PCDEM",,,,,,,,,,,,,,
R-065,Wolf Branch Creek 1,2001,,"estuarine wetlands, open water, tidal creek, freshwater wetlands and uplands",,"Mix (estuarine, freshwater, and upland)",,"estuarine wetlands, open water, tidal creek, freshwater wetlands and uplands",,Restoration,,181,,,27.74195,-82.44072,SWFWMD-SWIM,,,,,,,,,,,,,,,
R-066,Wolf Branch Creek 2,2001,,re-establish tidal flow to estuarine wetlands -enhancement only,,Estuarine,,re-establish tidal flow to estuarine wetlands -enhancement only,,Restoration,,134,,,27.74651,-82.44698,SWFWMD-SWIM,,,,,,,,,,,,,,,
E-050,Cypress Point Park Restoration,2002,,Coastal upland enhancement,,Upland,,,,Enhancement,,12.7,,,27.95087,-82.5418,City of Tampa,,,,,,,,,,,,,,,
E-051,Dog Leg Key,2002,,Planting of Spartina alterniflora,,Estuarine,,Planting of Spartina alterniflora,,Enhancement,,0.01,,,27.80226,-82.76168,FDEP Aquatic Preserves,,,,,,,,,,,,,,,
E-052,E.G. Simmons Park Salt Marsh Restoration: Phase 1,2002,,Planting of Spartina alterniflora,,Estuarine,,,,Enhancement,,1.5,,,27.9731,-82.5736,Tampa Bay Watch,NOAA,,,,,,,,,,,,,,
E-053,Mckay Bay Nature Park,2002,,"Upland restoration, exotic restoration",,Upland,,,,Enhancement,,5,,,27.9494,-82.41815,City of Tampa Parks and Recreation Department,,,,,,,,,,,,,,,
